id,description
8280040,"A un año de la disolución: altas y bajas en normas que aprobó el nuevo Congreso-Tras la disolución del Parlamento, el 30 de setiembre de 2019, y la instalación del nuevo, distintos proyectos de ley y reformas se admitieron, aunque algunas fueron cuestionadas y otras se dieron con dilaciones."
7160253,"Un conflicto que persiste a un año de la disolución del Congreso-Ha pasado un año desde la disolución del anterior Congreso y el escenario de crispación política parece ser el mismo. Pese a que hay una nueva representación parlamentaria, la confrontación entre poderes del Estado continúa. Diversos politólogos coinciden en que el jefe del Estado, Martín Vizcarra, se equivocó al no trabajar en la construcción de un bloque de aliados en el Poder Legislativo."
246500,"George Forsyth: “Todo lo que hemos logrado en este año y nueve meses ha sido con corazón”-George Forsyth indicó que para cambiar las cosas en La Victoria debería “ir a un nivel mucho mayor” y explicó que esa sería “la lógica” detrás de una postulación a la presidencia de la República."
1560372,"30-S: ¿Qué pasó con los personajes un año después de la disolución del Congreso?-"
6561867,"Martín Vizcarra: “La disolución del Congreso fue el epílogo de una etapa complicada”-El presidente de la República se pronunció al cumplirse un año del cierre del Congreso. Ratificó la constitucionalidad de dicho acto."
4165028,"30-S: Seis miembros del anterior y el actual período analizan la disolución del Congreso un año después-Un año después del 30 de setiembre del 2019, resulta necesario conocer el análisis de los principales afectados con la disolución del Congreso. Este Diario entrevistó a seis parlamentarios para conocer si mantienen la postura que fijaron en un inicio sobre la medida adoptada por el presidente Martín Vizcarra."
7242167,"Hoy es la fecha límite para afiliarse a organizaciones y participar en comicios internos-La Oficina Nacional de Procesos Electorales (ONPE) publicó el reglamento para que las organizaciones políticas que quieran participar en los comicios generales del 11 de abril del 2021 lleven a cabo sus elecciones internas para designar a sus candidatos, tanto a la plancha presidencial, como al Congreso y al Parlamento Andino."
1404162,"Ejecutivo discutirá hoy propuesta para brindar facilidades a personas con problemas de pago de créditos-El presidente Martín Vizcarra anunció que hoy, en Consejo de Ministros, se discutirá la propuesta para afrontar el problema de los créditos personales."
9635142,"Reunión entre Vizcarra y Merino: ¿Pondrá un alto al fuego en la confrontación entre el Gobierno y el Congreso?-El enfrentamiento entre el Gobierno y el Legislativo, que no ha sido el primero desde que este último asumió funciones a medidos de marzo, pareciera haberse diluido tras la reunión, o al menos así lo han dado a entender sus protagonistas."
8000730,"Partidos políticos siguen en busca de alianzas e incorporaciones-"
5329597,"Fase 4: ¿A qué destinos internacionales se podrá viajar desde el 5 de octubre?-Desde Santiago a Panamá, conoce la lista de ciudades a las que se podrá viajar con la reapertura de las fronteras comerciales."
6484661,"Presidente Vizcarra anunció la creación de la reserva Dorsal de Nasca para fines de 2020-Martín Vizcarra confirmó el proyecto en la Cumbre de la Biodiversidad de la ONU. Además, refirió que el Estado adoptó distintas medidas para preservar los ecosistemas a nivel nacional."
626700,"Elecciones 2021: No se usará el voto electrónico no presencial en comicios internos-"
5248646,"Daniel Urresti sería el candidato presidencial de Podemos Perú-Así lo manifestó el secretario general del partido, Enrique Wong, quien señaló que cuenta con el respaldo de José Luna Gálvez. Urresti ya está afiliado desde el pasado 17 de setiembre a esta agrupación."
6590310,"Sunafil crea plataforma de inspección del trabajo para Lima Sur-La Superintendencia Nacional de Fiscalización Laboral (Sunafil) creó la Plataforma de Inspección del Trabajo en la zona sur de Lima Metropolitana."
1332482,"Uso de GLP eleva consumo de combustibles limpios a 81% a nivel nacional-El mayor uso de GLP en los hogares peruanos elevó el consumo de combustibles limpios en el país en los últimos años. El 81% de las familias peruanas consume este tipo de combustible, informó la Sociedad Peruana de Gas Licuado (SPGL)."
3660377,"Martín Vizcarra brindó conferencia a un año de la disolución del Congreso [RESUMEN]-El mandatario Martín Vizcarra anunció que, a partir del 5 de octubre, se levantará la cuarentena focalizada en las provincias de Abancay, Huamanga y Huánuco. Además, señaló que esperan llegar a un acuerdo con el Congreso respecto al retiro de aportes de la ONP."
9478178,"Elecciones 2021: ONPE aprobó reglamento para que organizaciones políticas designen a sus candidatos-La Oficina Nacional de Procesos Electorales (ONPE) publicó el reglamento para que las organizaciones políticas que quieran participar en los comicios generales del 11 de abril del 2021 lleven a cabo sus elecciones internas para designar a sus candidatos, tanto a la plancha presidencial, como al Congreso y al Parlamento Andino."
9746871,"Alan García: ¿Por qué se ha confirmado el embargo de los bienes familiares?-La Sala de Apelaciones Transitoria Especializada en Extinción de Dominio de Lima ha rechazado el pedido de los familiares del fallecido expresidente Alan García para anular la inhibición y embargo que se dispuso sobre sus bienes investigados en el marco del Caso Odebrecht."
8705098,"Elecciones 2021: Parlamento Andino y las candidaturas que suelen pasar desapercibidas-El proceso electoral 2021 no solo servirá para elegir a un nuevo presidente, vicepresidentes y congresistas, sino que también nos permitirá conocer a los cinco nuevos representantes del Parlamento Andino. Esto último pese a que, desde hace varios años, se cuestiona la efectividad en las labores de la institución y existen proyectos de ley que proponen modificar su forma de elección."
7377928,"Presidente del Perú, Martín Vizcarra, comunica que el 8 de octubre será día laborable-<p>Esta noticia, el presidente del Perú, la comunicó durante la conferencia que realizó este miércoles para contar sobre las medida respecto al <span class="caps">COVID</span>-19.</p>"
7377928,"Presidente del Perú, Martín Vizcarra, comunica que el 8 de octubre será día laborable-<p>Esta noticia, el presidente del Perú, la comunicó durante la conferencia que realizó este miércoles para contar sobre las medida respecto al <span class="caps">COVID</span>-19.</p>"
8640245,"Hoy se cumple un año de la disolución del Congreso anterior-El presidente Martín Vizcarra disolvió constitucionalmente el Congreso de la República hace un año luego de considerar que el Legislativo había denegado fácticamente la cuestión de confianza presentada por el entonces presidente del Consejo de Ministros, Salvador del Solar y tomando en cuenta que el Parlamento ya le había negado la confianza al ex primer ministro Fernando Zavala durante el mismo periodo de Gobierno."
6256656,"Vuelos internacionales: Gobierno oficializa siete países con rangos de hasta cuatro horas por salida-Los primeros destinos que reabrirán su frontera comercial con el Perú son Colombia, Ecuador, Panama, Paraguay, Uruguay, Bolivia y Chile."
6499902,"Otra vez Andrés-"
8705642,"Martín Vizcarra promulga Ley de Trabajadoras del Hogar-Dicha norma fija un salario mínimo, un contrato por escrito, así como Gratificación y CTS completa. Como se recordará, la ley fue aprobada por el Congreso de la República el 5 de setiembre en el Pleno Mujer."
1197605,"Gobierno brindaría garantía para reprogramación de créditos de consumo-Mecanismo que plantea el Ejecutivo es similar al ya conocido Reactiva Perú, la condición sería que entidades del sistema financiero reduzcan tasas de interés en reprogramación de créditos a mypes, hipotecarios y consumo."
9119446,"Ejecutivo evalúa apoyo para créditos personales-"
4992285,"Shell eliminará hasta 9.000 empleos en su transición hacia energía de bajas emisiones-Royal Dutch Shell anunció el miércoles planes para recortar hasta 9,000 puestos de trabajo, una cifra equivalente a más del 10% de su plantilla, en el marco de una importante reorganización para transformar el gigante de la energía y gas en un grupo de bajas emisiones contaminantes."
4595236,"¿De qué manera se puede fomentar más empleo en el país?-"
8672272,"Elmer Cáceres sobre Majes Siguas II: “El Ejecutivo no quiere apostar por este proyecto” [VIDEO]-Gobernador de Arequipa solicitó públicamente una cita con el presidente Martín Vizcarra en Lima. Además, criticó la ausencia de ministros en sesión de Comisión de Presupuesto del Congreso."
9699580,"Billetera electrónica: Hasta 1 millón de peruanos migraría en 2020 a este canal de pago-Desde BiM indicaron que la billetera electrónica busca incluir financieramente al 60% de la población adulta que está al margen de este sistema, el cual es crucial para prevenir contacto directo en tiempos de COVID-19."
8392868,"Postergan hasta el 2025 inicio de operaciones del Aeropuerto Internacional de Chinchero-Anteriormente el Ministerio de Transportes y Comunicaciones indicó que este proyecto iniciaría sus operaciones en octubre del 2024."
2216598,"Cobre cae por dudas sobre economía mundial y aumento inventarios-Los precios del cobre caían el miércoles ya que el aumento de inventarios resaltó la perspectiva de un exceso de oferta, en medio de temores sobre el impacto del aumento de casos de COVID-19 en la economía mundial."
8765623,"Blume a un año de la disolución del Congreso: “Fue inconstitucional”-El 27 de setiembre del 2019, el Ejecutivo presentó una cuestión de confianza para que el Parlamento debata una modificación en la elección de miembros del Tribunal Constitucional (TC)."
4289664,"Mujeres y jóvenes de hasta 24 años fueron los más golpeados por la pérdida de empleo-La OIT advierte que “esta crisis estaría exacerbando los elevados niveles de desigualdad existentes antes de la irrupción de la pandemia”."
6996087,"Víctorhugo Montoya, jefe de la ONP: “No hay dinero y sólo se podrá pagar con deuda pública”-La Comisión de Defensa del Consumidor del Congreso aprobó el proyecto de ley que fue observado por el Ejecutivo y que permitiría el retiro de los aportes de la Oficina de Normalización Previsional (ONP) por hasta S/4300 para activos e inactivos. La medida permite además el retiro del 100% de los aportes de los inactivos con más de 65 años y de S/930 para los de la 19990."
7299236,"Precio del oro se encamina a cerrar su peor mes en 4 años ante fortaleza del dólar-Los precios del oro caían el miércoles e iban en camino a sufrir su mayor declive mensual en casi cuatro años, ya que el dólar se beneficiaba de la cautela en los mercados financieros tras el primer debate electoral entre los candidatos a la Casa Blanca."
259460,"América Latina fue la región que tuvo menos horas de trabajo en todo el mundo-Esto significa una pérdida estimada de casi 21% para los tres primeros trimestres de 2020, cifra que casi duplica el 11,7% respecto a la jornada a nivel mundial. La mayor disminución se registró entre abril y junio de este año."
2572785,"Venció plazo para eliminarlo y se mantiene el voto preferencial-El lunes venció el plazo que tenía el Congreso para concluir las reformas que se aplicarán en las elecciones del 2021 y una de las que quedó pendiente de debate y aprobación fue la eliminación del voto preferencial."
8821043,"OIT: 34 millones de empleos se perdieron por la crisis en América Latina-Fueron 32 millones de personas que dejaron de ser económicamente activas y alrededor de 2 millones de personas adicionales que perdieron el empleo y continuaron buscándolo."
4043324,"Elecciones 2021: Candidatos tienen hasta el 22 de diciembre para inscribirse-El lunes 28 de setiembre venció el plazo para incorporar modificaciones legislativas a la Ley Orgánica de Elecciones. En consecuencia, el Jurado Nacional de Elecciones (JNE) publicó ayer el cronograma electoral que regirá para las Elecciones Generales 2021."
6899788,"AAR sobre debate de Trump y Biden: “Se desmadró, fue una vergüenza” [VIDEO]-En Claro y Directo, Augusto Álvarez Rodrich habló del enfrentamiento de Donald Trump y Joe Biden durante el debate presidencial, el cual estuvo lleno de tensos momentos."
5477681,"George Forsyth sobre postulación a la Presidencia: “La decisión la tomaré en pocos días”-El alcalde de La Victoria, George Forsyth, sostuvo que si llega a ser candidato para las elecciones 2021, “todo está encaminado” en la Municipalidad de La Victoria."
4637940,"Empleo formal privado se recuperaría recién hacia el 2023-Entidad bancaria revela que si bien es cierto el empleo alcanzaría niveles del 2019 en el primer semestre del 2021, esta recuperación se daría mayoritariamente en el mercado laboral informal."
5134666,"Estas son las medidas de protección para reanudación de vuelos internacionales-<p>En octubre se reanudarán los vuelos internacionales y el Gobierno peruano ha establecido un sinnúmero de reglas para evitar el contagio de la <span class="caps">COVID</span>-19.</p>"
5134666,"Estas son las medidas de protección para reanudación de vuelos internacionales-<p>En octubre se reanudarán los vuelos internacionales y el Gobierno peruano ha establecido un sinnúmero de reglas para evitar el contagio de la <span class="caps">COVID</span>-19.</p>"
233200,"Requena sobre relación entre el Ejecutivo y Congreso: “La confrontación persiste” [VIDEO]-José Carlos Requena, analista político, explicó cuál es el escenario político a un año de la disolución del Congreso."
2590376,"Billetera electrónica triplicaría su alcance para segundo pago del Bono Universal-Desde el Midis buscan impulsar este mecanismo de entrega para evitar contagios de COVID-19 en último tramo del subsidio de 760 soles."
9642712,"EL PJ admitió a trámite casación de Humberto Acuña contra condena por cohecho-El Poder Judicial (PJ) admitió a trámite el recurso de casación que interpuso el congresista de Alianza Para el Progreso (APP) Humberto Acuña, contra la condena suspendida que se le impuso luego de ser hallado responsable del delito de cohecho pasivo genérico a inicios de setiembre, según resolución a la que accedió El Comercio."
7996255,"Martín Vizcarra sobre Manuel Merino: Le dije que no estuve de acuerdo con trámite de vacancia, pero lo superamos-El presidente de la República, Martín Vizcarra, aseguró que en la conversación que sostuvo este lunes con el titular del Congreso, Manuel Merino, le dijo que no estuvo de acuerdo con el proceso de vacancia que se llevó a cabo hace semanas y que no consiguió los votos para retirarlo del cargo. Sin embargo, indicó que pese a esto se superó la discrepancia para que ambos poderes del Estado trabajen juntos contra la pandemia del nuevo coronavirus (COVID-19)."
7642489,"Ministerio de Trabajo fijaría incentivos para la contratación formal: ¿Qué medidas factibles proponen expertos?-"
283868,"RMP: “Con el cambio del Congreso mantenemos el clima de hostilidad ¿Por qué?” [VIDEO]-En Sin Guion, Rosa María Palacios explicó cuáles son las lecciones a un año de la disolución del Congreso."
6600022,"Arequipa: concesionaria de Majes Siguas II anuncia su salida del megaproyecto-Se va. Grupo Cobra argumenta que no consiguió respaldo y tampoco las garantías del Estado para el financiamiento. Además, envió documento al Gobierno regional de Arequipa y al Ejecutivo para iniciar el proceso de resolución del contrato."
148874,"6 laboratorios están interesados en probar sus vacunas contra la COVID-19 en Perú-<p>Esta semana comenzó en Lima una segunda ronda de aplicación de la vacuna desarrollada por Sinopharm a unos 3.000 voluntarios inscritos en la página web de la Universidad Nacional Mayor de San Marcos.</p>"
148874,"6 laboratorios están interesados en probar sus vacunas contra la COVID-19 en Perú-<p>Esta semana comenzó en Lima una segunda ronda de aplicación de la vacuna desarrollada por Sinopharm a unos 3.000 voluntarios inscritos en la página web de la Universidad Nacional Mayor de San Marcos.</p>"
9896105,"Chehade afirma que la Comisión de Constitución priorizará el retorno a la bicameralidad-El congresista Omar Chehade (APP), quien preside el grupo de trabajo parlamentario, precisó que también trabajarán para la aprobación del Código Electoral."
8088064,"Keiko y el TC: a un año del proyecto del Ejecutivo que fue clave para la disolución del Congreso-Se quiere “tomar el control del Tribunal Constitucional”, advirtió Martín Vizcarra tras conocer que se ofreció la permanencia a los magistrados que votarían sobre un habeas corpus que buscaba sacar a Keiko Fujimori de prisión. Empujones, votaciones, tensión e incertidumbre: así se selló la disolución del Congreso."
9157509,"Perú ejercerá la vicepresidencia en la prestigiosa Organización Internacional del Cacao-Nuestro país será el encargado de velar por el desarrollo sostenible de este cultivo en América Latina y el Caribe, liderando una lista de más de 40 países en todo el mundo."
4160966,"TC: instituciones presentan aportes para el reglamento de selección de magistrados-El Instituto de Defensa Legal, el Grupo de Trabajo Contra la Corrupción y la Coordinadora Nacional de DD. HH. precisaron propuestas a fin de que el proceso se lleve con transparencia."
4513128,"Pese a la pandemia, exportaciones de uva sumaron 439 millones de dólares, 23% más que en 2019-Solo hasta julio, nuestro país envió casi 200.000 toneladas de uva hacia mercados de los cinco continentes. Los productos peruanos son de lo más valorados en el hemisferio norte."
7501299,"Ana Neyra: “Esta elección (del Tribunal Constitucional) llega en un momento complejo”-Ministra de Justicia invoca al Congreso a tomar en cuenta las observaciones de la sociedad civil para el reglamento de elección de miembros del TC."
4860090,"Dólar llega a máximos en 18 años y cierra en S/ 3,599-Cotización. Tipo de cambio aumentó ante la cautela por el esperado debate entre Donald trump y Joe Biden."
4831246,"Tribunal Constitucional: más observaciones en reglamento del concurso-Cambios. Defensoría del Pueblo y Servir envían propuestas de mejora a la Comisión Especial del Congreso para elección del TC."
4114526,"Hasta hoy son las afiliaciones en los partidos políticos-Temporada de fichajes. El expremier Pedro Cateriano se inscribió en Todos por el Perú. Jorge Nieto Montesinos no alcanzó a inscribir al Partido del Buen Gobierno y desistió de competir por la presidencia. El JNE presentó ayer el cronograma electoral. Segunda vuelta será en junio."
527137,"Unos 7,4 mllns de hogares peruanos poseen internet-Mejora. Al 2019, el 64,5% de viviendas de los niveles socioeconómicos más vulnerables cuenta con esta conexión."
1230059,"Ejecutivo irá por el reajuste de tasas de interés-En reprogramación de deudas. Debido a los problemas de pago de créditos personales del sistema financiero, el Gobierno buscará alcanzar una solución en consenso con el Congreso."
5955956,"Retiro ONP: Comisión de Defensa del Consumidor del Congreso aprobó predictamen por la insistencia-Con votación unánime, la comisión que preside el congresista José Luna Morales es la primera de las cuatro que deben evaluar la autógrafa observada."
2151792,"Comisión aprueba cambios en Ley de Publicidad Estatal-Congreso. Establecen mecanismos para descentralizar publicidad a medios del interior del país. Obtuvo 11 votos a favor."
7094504,"Bono Universal: segundo pago se iniciará el 10 de octubre-Subsidio de s/ 760 . Cronograma de pagos será hasta diciembre. Se depositará en cuentas bancarias y medios electrónicos. Para las zonas rurales ya se habilitan colegios."
5168309,"Aún falta impulsar los medios de pago digitales para compras en línea-"
4594066,"George Forsyth ya aparece como afiliado al partido Restauración Nacional en el ROP-El alcalde de La Victoria, George Forsyth, ya figura registrado como afiliado al partido Restauración Nacional en el Registro de Organizaciones Políticas del Jurado Nacional de Elecciones."
7202896,"Nelson Shack afirma que informe sobre Mirian Morales ya se derivó a la procuraduría-El contralor de la República, Nelson Shack, señaló este martes que el informe emitido por este organismo sobre la intervención de Mirian Morales en la contratación de Claudia Mere en el Ministerio de Transportes y Comunicaciones (MTC), ya fue derivado a la Procuraduría."
2901997,"Contralor Nelson Shack: informe sobre Mirian Morales ya fue derivado a Procuraduría-El contralor de la República, Nelson Shack, señaló este martes que el informe emitido por este organismo sobre la intervención de Mirian Morales en la contratación de Claudia Mere en el Ministerio de Transportes y Comunicaciones (MTC), ya fue derivado a la Procuraduría."
7077116,"Recomiendan utilizar las tecnologías previo a emprender negocios-Según Luigi Cabos, coordinador de la carrera de negocios de la Universidad Privada del Norte, ello puede aumentar las oportunidades de ventas."
8389196,"George Forsyth presenta descargos ante JNE por presunta vulneración de normativa electoral-El alcalde de La Victoria, George Forsyth, presentó sus descargos ante el Jurado Nacional de Elecciones (JNE) por la presunta vulneración a la normativa electoral y solicitó se archive el caso."
6128659,"Osiptel: 7,48 millones de hogares estaban conectados a Internet en el 2019-La encuesta de Osiptel reveló también que el 78,6% de hogares cuenta con por lo menos un dispositivo móvil para conectarse"
8704690,"Proyecto de masificación de gas Siete Regiones se posterga nuevamente, esta vez por seis meses-ProInversión señala que la decisión fue adoptada a pedido de los postores, afectados por el COVID-19. Buena pro se realizará el 19 de marzo del 2021."
6527129,"Elecciones 2021: sorteo de miembros de mesa se realizará el 31 de enero del próximo año-El Jurado Nacional de Elecciones (JNE) publicó este martes el cronograma electoral para el proceso electoral del 2021 en el boletín de normas legales del diario El Peruano y en este se detalla que el concurso para la elección de miembros de mesa se llevará a cabo el domingo 31 de enero."
4167741,"OXL: 5 datos para incrementar el valor del vehículo para su venta-Consejos implican el arreglo del vehículo, tener los documentos en regla, tasarlo adecuadamente, conocer su demanda, entre otros."
2704959,"Scotiabank: ventas minoristas se recuperarían en el 2021, pero no alcanzarían niveles prepandemia-El sector comercio crecería cerca de 11% el 2021, según proyecciones de Scotiabank, pues se prevé una atención normal en los locales comerciales, asumiendo que no habrá nuevos rebrotes del coronavirus y una gradual recuperación del empleo y los ingresos."
5953269,"Ministerio de Vivienda buscaría que el 100% del bono de Renta Joven vaya dedicado al pago del alquiler-Las modificaciones al programa Renta Joven estarían implementadas antes de fin de año, señaló el ministro de Vivienda, Construcción y Saneamiento, Carlos Lozada. El objetivo es incentivar las solicitudes, ante la poca demanda del bono."
8449982,"Majes Siguas II: ministros y ProInversión no acudieron a la sustentación de proyecto de ley-La ministra de Economía y Finanzas, María Antonieta Alva y el titular de Agricultura, Jorge Montenegro, estaban invitados, pero no asistieron ni enviaron a un representante."
3057291,"Cervecería dará 50.000 soles a ganadores de programa de competencia para reactivar negocios-Marca Cusqueña indicó que los negocios participantes también podrán formar parte de una iniciativa de Backus que busca contribuir a las empresas gastronómicas."
4962480,"Ministerio de Vivienda implementará cambios al bono Renta Joven antes de fin de año-Las modificaciones al programa Renta Joven estarían implementadas antes de fin de año, señaló el ministro de Vivienda, Construcción y Saneamiento, Carlos Lozada. El objetivo es incentivar las solicitudes, ante la poca demanda del bono."
7466759,"Directorio de Graña y Montero propone cambiar de nombre a la empresa-El directorio de Graña y Montero S.A.A. planteó a la Junta General de Accionistas de la compañía modificar la denominación social de la misma."
3552354,"Fernando Olivera inscribe al Frente Esperanza en el JNE para las elecciones del 2021-Fernando Olivera presentó, en la mañana de este 29 setiembre, la solicitud de inscripción del Frente Esperanza ante el Jurado Nacional de Elecciones (JNE) con miras a las elecciones generales del 2021 que serán desarrolladas el domingo 11 de abril del 2021."
873146,"Elecciones 2021: Pedro Cateriano se inscribió en Todos por el Perú-El ex primer ministro Pedro Cateriano confirmó este martes su afiliación al partido Todos por el Perú (TPP) en el marco de las próximas Elecciones Generales 2021."
7284434,"Elecciones 2021: Pedro Cateriano se inscribió en partido Todos por el Perú-El ex primer ministro Pedro Cateriano confirmó este martes su afiliación al partido Todos por el Perú (TPP) en el marco de las próximas Elecciones Generales 2021."
324324,"Elecciones 2021: candidatos que entreguen dádivas serán excluidos del proceso electoral-Los candidatos del próximo proceso electoral que entreguen dádivas como dinero, regalos, alimentos, medicinas, entre otros, ya sea de manera directa o indirecta, podrían recibir sanciones drásticas como la exclusión de las Elecciones Generales 2021."
