id,description
8477047,"Balance anual del 30-S: ¿sin salida?-"
7456395,"Salvador del Solar afirmó que no sería “responsable" presentar una postulación-El exprimer ministro Salvador del Solar reiteró este miércoles que no tiene intenciones de ser candidato presidencial en el marco de las próximas Elecciones Generales 2021. En ese sentido, aseguró que tampoco se afiliará a ningún partido político, estando próximos a la hora de vencimiento del plazo."
6988755,"DolarToday Venezuela: consulta aquí el precio del dólar en el país caribeño, hoy jueves 1 de octubre-DolarToday | El precio del dólar en Venezuela operaba al alza este jueves 1 de octubre, mientras las autoridades de ese país localizaron 759 nuevos casos de la COVID-19, con lo que la cifra total se eleva hasta los 75.122, mientras que siete personas más fallecieron por la enfermedad que causa el nuevo coronavirus, con lo que ya son 628, informaron este miércoles fuentes oficiales."
3773606,"Fintech aumentaron 39% su financiamiento pese a  COVID-19, para activos y capital de trabajo-"
3531440,"Salvador del Solar dice que sería “responsable" ser candidato presidencial-El exprimer ministro Salvador del Solar reiteró este miércoles que no tiene intenciones de ser candidato presidencial en el marco de las próximas Elecciones Generales 2021. En ese sentido, aseguró que tampoco se afiliará a ningún partido político, estando próximos a la hora de vencimiento del plazo."
5041089,"Sala Penal revoca impedimento de salida del país contra Gerardo Sepúlveda-La Sala Penal Anticorrupción de la Corte Superior Nacional de Justicia Penal Especializada revocó este miércoles el impedimento de salida del país por cuatro meses contra el empresario Gerardo Sepúlveda, en el marco de la investigación que se le sigue por el delito de colusión en agravio del Estado."
3294486,"Martos tras reunión con titular del Congreso: Estamos de acuerdo en que hemos volteado la página-El primer ministro, Walter Martos, se reunió esta tarde con el presidente del Congreso, Manuel Merino de Lama y aseguró que ambos están “completamente de acuerdo” en que han “volteado la página” tras la crisis política y el rechazo del pedido de vacancia presidencial contra Martín Vizcarra."
7390160,"Gerardo Sepúlveda: sala penal revoca impedimento de salida del país en su contra por seis meses-La Sala Penal Anticorrupción de la Corte Superior Nacional de Justicia Penal Especializada revocó este miércoles el impedimento de salida del país por cuatro meses contra el empresario Gerardo Sepúlveda, en el marco de la investigación que se le sigue por el delito de colusión en agravio del Estado."
310141,"Wong: Podríamos decir que Daniel Urresti es el candidato natural de Podemos Perú-"
7838216,"Martos tras reunión con Manuel Merino: Estamos de acuerdo en que hemos volteado la página-El primer ministro, Walter Martos, se reunió esta tarde con el presidente del Congreso, Manuel Merino de Lama y aseguró que ambos están “completamente de acuerdo” en que han “volteado la página” tras la crisis política y el rechazo del pedido de vacancia presidencial contra Martín Vizcarra."
950311,"Gobierno permitirá vuelos internacionales a siete países desde la próxima semana-El presidente de la República, Martín Vizcarra, anunció que a partir de la próxima semana se reanudarán los vuelos internacionales desde el Perú hacia siete países de la región."
7521212,"Congresista Rolando Ruiz informó que comisión especial del TC recibió 69 mensajes-El presidente de la comisión especial encargada de elegir a los nuevos magistrados del Tribunal Constitucional (TC), Rolando Ruiz (Acción Popular), informó que el grupo de trabajo ha recibido 69 mensajes remitidos por la ciudadanía y diversas instituciones sobre el reglamento que regulará el proceso de selección de magistrados."
3878167,"Apenas el 10% de empresas medianas en el Perú hacen compras digitales-"
1637893,"Tribunal Constitucional notifica al Congreso que admitió a trámite demanda competencial del Ejecutivo-El Tribunal Constitucional (TC) informó este miércoles que notificó al Congreso de la República la resolución de admisibilidad de la demanda competencial que interpuso el Poder Ejecutivo en contra de la moción de vacancia del presidente Martín Vizcarra."
4633385,"Ley de publicidad estatal: CPP cuestiona aprobación de modificaciones en Comisión de Transportes-"
5985632,"George Forsyth presentó descargos ante el JNE por presunta vulneración de normativa electoral-"
2194015,"Si tengo COVID-19, ¿debo dejar de bañarme? (VIDEO)-A raíz de que el nuevo coronavirus (COVID-19) es una enfermedad que no tiene más de un año en el planeta, las especulaciones sobre los tratamientos y síntomas surgen día a día. Dentro de esa esfera se encuentra la creencia de evitar bañarse al conocer que se padece de la afección."
8796852,"Bañarse con agua caliente por un tiempo prolongado puede ocasionar un paro cardíaco-Médico indica que si alguien pasa mucho tiempo bañándose con agua caliente, al salir se puede producir una caída brusca de la presión, lo que provocaría una dilatación de pequeños capilares sanguíneos"
860685,"Inscríbete AQUÍ para ser parte del tercer grupo de ensayos clínicos de la vacuna contra COVID-19-El equipo de investigadores de la Universidad Nacional Mayor de San Marcos (UNMSM) y de la Universidad Peruana Cayetano Heredia (UPCH) informó que hoy 30 de setiembre, se abrió el registro para el tercer grupo de 1.000 voluntarios para los ensayos clínicos de fase III de dos vacunas inactivadas de Sinopharm contra el nuevo coronavirus (COVID-19) en el Perú. El registro se llevará a cabo en la página web www.vacunacovid.pe."
2413302,"¿Cómo quitar los malos olores que se impregnan a la ropa?-A veces los malos olores pueden ser provocados por usar demasiado detergente, lavar siempre en frío, meter muchas prendas al mismo tiempo, utilizar siempre el lavado rápido, entre otros motivos."
4687608,"Promulgan ley que garantiza sueldo mínimo y gratificación para trabajadoras del hogar-El presidente de la República Martín Vizcarra promulgó la Ley de las trabajadoras y trabajadores del hogar, aprobada hace unas semanas en el Pleno Mujer del Congreso de la República."
1606091,"Comisión de Ética rechaza investigar a Guillermo Aliaga por presuntos vínculos con ‘Los Cuellos Blancos del Puerto’-La Comisión de Ética del Congreso rechazó este miércoles, por mayoría, abrir una indagación al congresista Guillermo Aliaga (Somos Perú) por sus presuntos vínculos con la organización criminal ‘Los Cuellos Blancos del Puerto’."
2251934,"Formación política: más allá de la calle y los títulos-"
3452842,"TC notifica a Congreso admisibilidad de demanda competencial contra la vacancia-Entidad constitucional dio un plazo de 30 días al Congreso de la República para responder. Admisibilidad fue aprobada con seis votos a favor y uno en contra."
2118610,"Tipo de cambio: este es el precio del dólar en el Perú hoy miércoles 30 de septiembre-Precio del dólar en Perú | El tipo de cambio operaba a la baja el miércoles en la plaza local en medio de la fortaleza global del dólar en los mercados internacionales, tras un caótico debate presidencial en Estados Unidos que irrigaba incertidumbre a los mercados, así como por los temores a más contagios de coronavirus."
7385618,"El precedente que marcó el Tribunal Constitucional tras la disolución del Congreso en el 2019-La negación de la cuestión de confianza fáctica del Parlamento y la infracción del principio de separación de poderes fueron temas debatidos respecto a su constitucionalidad, sin embargo, el TC declaró fundada la decisión de Vizcarra."
4597644,"TC notifica al Congreso que admitió a trámite demanda competencial del Ejecutivo-El Tribunal Constitucional (TC) informó este miércoles que notificó al Congreso de la República la resolución de admisibilidad de la demanda competencial que interpuso el Poder Ejecutivo en contra de la moción de vacancia del presidente Martín Vizcarra."
148451,"Actividades turísticas deben tener mayor difusión para generar más empleo, según Copei-"
3202195,"Salvador del Solar: “Rosa Bartra pidió que cierren la puerta delante de mí"-El expremier reveló que fue la excongresista Rosa Bartra quien ordenó  impedir su ingreso al hemiciclo el día que se resolvió el cierre del Congreso."
9684580,"Ricardo Belmont se afilió al partido Unión por el Perú y participará en las elecciones del 2021-El exalcalde de Lima Ricardo Belmont se inscribió en el partido Unión por el Perú (UPP), según informó El Comercio."
4482609,"Martín Vizcarra: el día que decidió disolver el Congreso y convocar elecciones [VIDEO]-Este 30 de setiembre se cumple un año de la decisión del presidente de disolver el Parlamento Nacional tras el rechazo de la cuestión de confianza hacia el Gabinete liderado por Salvador del Solar."
6411793,"Vizcarra: Seguramente retomaremos entrevistas cuando la pandemia nos dé mayor tranquilidad-El presidente de la República, Martín Vizcarra, dijo que "seguramente" volverá a brindar entrevistas una vez que las curvas de contagio de la pandemia del nuevo coronavirus (COVID-19) desciendan, ya que aseguró que la emergencia ha impedido que responda de forma exclusiva a algún medio de comunicación."
8306144,"Ética rechazó investigar a Guillermo Aliaga por presuntos vínculos con Los Cuellos Blancos-Con cuatro votos en contra y dos a favor, la Comisión de Ética negó abrir una indagación preliminar al segundo vicepresidente del Congreso, luego de conocerse su relación con dos miembros de la organización criminal."
7598276,"Adiós a la delación compensada, por Alejandro Falla-“La norma aprobada por el Congreso establece pena privativa de la libertad entre dos y seis años para ‘el que abusa de su posición dominante en el mercado’”, dice el socio de Bullard Falla Ezcurra +"
3458575,"Martos: “Hemos pedido aplazar debate sobre ONP hasta que Ejecutivo converse con bancadas”-Walter Martos se reunió este miércoles con Manuel Merino en el Congreso. A su salida, el primer ministro señaló que hablaron sobre la ley ONP y la reprogramación de deudas."
1727801,"Carla García al APRA: ¿Qué otros hijos de expresidentes incursionaron en la política?-Ministros, congresistas y candidatos a la presidencia. En la historia del Perú, la lista de políticos que continuaron el legado de sus padres continúa creciendo."
687219,"Dólar Perú: Tipo de cambio hoy, miércoles 30 de setiembre-A las 9:33 de la mañana, el dólar se cotizaba a S/ 3.5951 en el mercado interbancario, un nivel menor en 0.11% frente a los S/ 3.5990 del cierre del martes."
1795965,"Walter Martos se reunirá esta tarde con Manuel Merino-El presidente del Consejo de Ministros, Walter Martos, informó este miércoles que se reunirá esta tarde “a las 6 p.m” con el presidente del Congreso, Manuel Merino, “para pasar de las palabras a los hechos” luego de la reunión que sostuvo el lunes pasado Martín Vizcarra."
5709102,"Vizcarra a un año de la disolución del Congreso: “No fue una herramienta para controlar las instituciones”-El presidente Martín Vizcarra aseguró este miércoles que la disolución del Congreso de la República que llevó a cabo el 30 de setiembre del 2019 no buscó “controlar los poderes e instituciones”."
6643234,"Vizcarra: candidatos para elecciones del 2021 deberán pronunciarse sobre reformas políticas pendientes-El presidente de la República, Martín Vizcarra, dijo que los candidatos a las elecciones generales del 2021 deberán pronunciarse sobre los aspectos de la reforma política que todavía no han sido aprobados en el Congreso de la República, tras rescatar que varios de los proyectos que presentó el Ejecutivo serán aplicados en los comicios del próximo año."
5842754,"Pleno agenda para mañana debate sobre congelamiento de deudas-Se discutirían dos dictámenes aprobados, una en la Comisión de Economía y otra de Defensa del Consumidor. Premier Walter Martos pidió postergar debate hasta que se escuche propuesta del Ejecutivo."
4550254,"DolarToday Venezuela: consulta aquí el precio del dólar en el país llanero, hoy miércoles 30 de septiembre-DolarToday | El precio del dólar en Venezuela operaba al alza este miércoles 30 de septiembre, mientras las autoridades de ese país localizaron 835 contagios más de coronavirus, con lo que ya son 74.363 los casos registrados, mientras que 7 personas más fallecieron en las últimas 24 horas por la enfermedad, informó este martes la vicepresidenta ejecutiva, Delcy Rodríguez."
4405768,"México: ¿a cuánto se cotiza el precio del dólar hoy miércoles 30 de septiembre?-El tipo de cambio operaba a la baja el miércoles en México por la apreciación del peso junto a la mayoría de las monedas de países emergentes luego de tres jornadas a la baja, un día después de un esperado debate presidencial en Estados Unidos que no generó demasiado impacto entre inversionistas."
7826329,"¿Qué tipo de salvavidas debe dar el Gobierno para las personas naturales que tienen problemas de pago?-"
8188849,"Ministra Neyra: Gobierno mantendrá “neutralidad” en elecciones generales del 2021-La ministra de Justicia y Derechos Humanos, Ana Neyra, garantizó este miércoles que el Gobierno actuará “sin favorecer ni perjudicar a ninguna organización política” de acuerdo al principio de neutralidad en el marco de las Elecciones Generales del 2021."
7510214,"Elecciones 2021: exalcalde de Lima Ricardo Belmont se afilió a UPP-El exalcalde de Lima Ricardo Belmont se afilió a Unión por el Perú (UPP), según informó el vocero de esa agrupación José Vega. Aún no se ha definido si solo postulará al Congreso o si buscará integrar la plancha presidencial."
665307,"Vizcarra: Casinos, casas de juego y tragamonedas aún están prohibidos y no pueden operar-El presidente de la República, Martín Vizcarra, aseguró este miércoles que los casinos, casas de juego y los locales de tragamonedas aún no pueden reanudar sus operaciones porque son actividades que están prohibidas durante el inicio de la fase 4 de reactivación económica que empieza mañana 1 de octubre."
72690,"Si Majes Siguas II no se destraba en 45 días, la obra se estancaría tres años, advierte el Gobierno-El Gobierno advirtió que si no se transfiere el proyecto de irrigación Majes Siguas II al Ejecutivo, reactivar la obra tardaría tres años."
7749600,"Disolución del Congreso: los que se fueron, los que llegaron y otros cambios tras el 30 de setiembre-Hoy se cumple un año del cierre del Parlamento, que ahora tiene una nueva composición. Atrás quedó la mayoría de Fuerza Popular, lugar que ahora ostenta AP. Mientras que el Frepap regresó al hemiciclo tras casi dos décadas."
8874343,"Congreso: Comisión de Ética rechaza indagación preliminar contra Guillermo Aliaga por presuntos vínculos con Los Cuellos Blancos-La Comisión de Ética del Congreso rechazó, por mayoría, el inicio de una indagación preliminar contra el congresista Guillermo Aliaga (Somos Perú) por sus presuntos vínculos con la red criminal “Los Cuellos Blancos del Puerto”. El grupo lo desestimó con los en contra de los congresistas Tania Rodas (APP), César Gonzáles (Somos Perú), Walter Rivera (Acción Popular), Miguel Vivanco (Fuerza Popular). Los votos a favor de las indagaciones fueron de las congresistas Luz Cayguaray (Frepap) y Zenaida Solís (Martido Morado)."
8335920,"Ministra Neyra: Gobierno mantendrá neutralidad de comicios parlamentarios en elecciones generales del 2021-La ministra de Justicia y Derechos Humanos, Ana Neyra, garantizó este miércoles que el Gobierno actuará “sin favorecer ni perjudicar a ninguna organización política” de acuerdo al principio de neutralidad en el marco de las Elecciones Generales del 2021."
6246000,"Comisión de Economía votará insistencia de devolución de aportes ONP la próxima semana-Grupo de trabajo del Congreso recibió este miércoles a la titular del MEF, María Antonieta Alva."
5348696,"Desinformación y estafas, las consecuencias de no elegir correctamente las apps para invertir en bolsa-"
4712780,"Amplían hasta el 31 de diciembre el plazo para fraccionar deudas tributarias-"
3024506,"Ejecutivo plantea otorgar garantía estatal a personas con problemas para pago de créditos de consumo, de vivienda y mypes-El presidente de la República, Martín Vizcarra, anunció este miércoles que el Ejecutivo enviará un proyecto de ley al Congreso que plantea otorgar una garantía estatal para que las personas que no puedan pagar sus deudas puedan reprogramar créditos de consumo, créditos hipotecarios y microempresa, en medio de la crisis económica por el impacto por el COVID-19."
9247853,"Martín Vizcarra: candidatos para elecciones del 2021 deberán pronunciarse sobre reformas políticas pendientes-El presidente de la República, Martín Vizcarra, dijo que los candidatos a las elecciones generales del 2021 deberán pronunciarse sobre los aspectos de la reforma política que todavía no han sido aprobados en el Congreso de la República, tras rescatar que varios de los proyectos que presentó el Ejecutivo serán aplicados en los comicios del próximo año."
1222933,"Programa Juntos: conoce quiénes son los beneficiarios del bono mensual brindado por el Midis-Este subsidio de 100 soles fue aprobado por el gobierno del presidente Martín Vizcarra para apoyar a aquellas familias de exiguos recursos."
4795659,"Ejecutivo promulgó ley que garantiza sueldo mínimo y gratificación para trabajadoras del hogar-El presidente Martín Vizcarra promulgó la Ley de las trabajadoras y trabajadores del hogar, aprobada hace unas semanas en el Pleno Mujer del Congreso de la República."
8126143,"Walter Martos llegó al Congreso para reunión con Manuel Merino-Primer ministro ingresó cerca de las 6.00 p. m. al Palacio Legislativo para coordinar temas relacionados a la lucha contra la COVID-19 y la reactivación económica."
3683797,"Luz del Sur y Enel virtual: ¿cómo ver y fraccionar mi deuda de electricidad?-Revisa cómo revisar tu recibo de luz de forma online, mediante las plataformas oficiales de las instituciones eléctricas."
3693137,"Martín Vizcarra a un año de la disolución del Congreso: “No fue una herramienta para controlar las instituciones”-El presidente Martín Vizcarra aseguró este miércoles que la disolución del Congreso de la República que llevó a cabo el 30 de setiembre del 2019 no buscó “controlar los poderes e instituciones”."
2668015,"Pedro Cateriano asegura que Todos por el Perú no copiará las acciones que han generado inestabilidad política-El expresidente del Consejo de Ministros Pedro Cateriano dijo que participará en el lugar “que el partido determine” , un día después de afiliarse oficialmente a Todos por el Perú, y garantizó que esta agrupación política no copiará las actitudes que han generado inestabilidad política en los últimos años."
9408105,"Elecciones 2021: Excongresista Sergio Tejada y exministra Aída García Naranjo se afilian a Juntos por el Perú-Hoy, 30 de setiembre, vence el plazo para que los interesados en postular a las elecciones del 2021 se afilien a una agrupación política. Sus fichas registrales tienen que ser elevadas al Registro de Organizaciones Políticas del Jurado Nacional de Elecciones."
1715609,"Sunat consultas EN LÍNEA: ¿cómo consultar el RUC de una persona o empresa de manera virtual?-Entra a www.sunat.gob.pe y podrás enterarte de cómo revisar tu RUC, así como otros trámites que puedes gestionar desde tu hogar."
779776,"Julio Guzmán: “¿Vamos a elegir payasos? No, el país no necesita eso"-El líder del Partido Morado, Julio Guzmán, aseguró este miércoles que el Perú “necesita una opción seria” para las elecciones generales del 2021 y precisó que el Partido Morado “ha venido trabajando” para ofrecer una propuesta que se enfoque en “devolverle la confianza a la gente”."
885579,"EN VIVO | Martín Vizcarra brinda pronunciamiento-A partir de la una de la tarde, el presidente de la república Martín Vizcarra brindará un pronunciamiento a la Nación. Una fecha importante al cumplirse un año de la disolución del Congreso y que ha generado una crisis política entre el Ejecutivo y Legislativo."
7714814,"Mañana se debatirá proyecto de ley que prohíbe que se generen cargos adicionales a los establecidos al otorgar préstamos-"
2399518,"Falleció excongresista Humberto 'Charro’ Requena a los 92 años-El también exalcalde del distrito de Catacaos, Piura, fue reconocido en el 2019 como ‘hijo ilustre’ por el municipio que lideró por 11 años."
16526,"Elecciones 2021: ¿La publicidad en redes sociales se podrá contratar con el financiamiento público indirecto?-El pasado 26 de setiembre, se promulgó la última ley que aplicará para el proceso electoral del 2021: la norma que modifica una serie de aspectos sobre el financiamiento de partidos políticos. Uno de esos cambios establece que el financiamiento público podrá ser utilizado por las organizaciones políticas para contratar publicidad en redes sociales, pese a que la Constitución Política no lo permite."
3307826,"Excongresista del FIM Humberto Requena falleció a los 92 años-El excongresista Humberto Requena falleció este miércoles a los 92 años de edad. El exlegislador quien fue parte del Parlamento del 2001 al 2006 con la bancada del Frente Independiente Moralizador (FIM) llevada una semana de tratamiento médico en su domicilio según informó la Agencia Andina."
1442784,"Pedro Cateriano ante eventual precandidatura en TPP: “Eso lo decidirá el partido”-El ex primer ministro Pedro Cateriano -quien recientemente confirmó su afiliación al partido Todos por el Perú (TPP)- aseguró que respetará la decisión de las bases ante una posible precandidatura presidencial en el marco de las próximas Elecciones Generales 2021."
5428047,"“Dólar blue” en Argentina: conoce aquí cuál es su precio hoy miércoles 30 de septiembre de 2020-Dólar blue | El tipo de cambio oficial subía el miércoles en Argentina en una jornada en que los activos del país sudamericano registraban selectivas mejoras por compras de oportunidad ante sus atractivos valores, en un contexto expectante de negocios dadas las persistentes dudas sobre el futuro de la economía doméstica."
7726611,"BCP señala un rebote de la economía y prevé que puede crecer hasta 15% en 2021-El Banco de Crédito del Perú (BCP) señaló que los indicadores del Perú muestran una clara reactivación económica, pero con una velocidad de recuperación cada vez más gradual. Así, la entidad bancaria proyecta que en un escenario base el PBI sería de entre 6 y 10% para el 2021 y, en un escenario optimista, entre 10% y 15%, según dijo su gerente de Estudios Económicos, Carlos Prieto."
666400,"Congreso: Comisión especial del TC debatirá anteproyecto de reglamento este sábado-La Comisión especial encargada de elegir a los nuevos magistrados del Tribunal Constitucional (TC) sesionará este sábado, desde las 10 de la mañana, para consolidar y debatir el reglamento final bajo el cual se realizará el proceso de elección. En la reunión que tuvieron este miércoles, los congresistas miembros del grupo manifestaron cuáles son las coincidencias respecto de las sugerencias recibidas."
4208386,"Nombre del 2020 en el Perú: ¿por qué se llama “Año de la universalización de la salud”?-Descubre las razones para que el presidente Martín Vizcarra escogiera este nombre. Además, conoce la importancia de utilizar esta denominación en los documentos oficiales."
9540909,"Martín Vizcarra al Congreso: “Pasemos de las declaraciones a los hechos”-El mandatario invocó al Parlamento a trabajar de forma conjunta “en favor de los peruanos”. Agregó que espera llegar a un consenso respecto al retiro de aportes de la ONP."
2706737,"Tipo de cambio: Dólar sigue subiendo y alcanza barrera de 3,60 soles-Precio del dólar se dispara, según especialistas, tras debate electoral en Estados Unidos entre el presidente Donald Trump y el candidato Joe Biden."
6961009,"Julio Guzmán sobre elecciones 2021: “El país necesita una opción seria que haya sido planificada y trabajada”-El líder del Partido Morado, Julio Guzmán, aseguró este miércoles que el Perú “necesita una opción seria” para las elecciones generales del 2021 y precisó que el Partido Morado “ha venido trabajando” para ofrecer una propuesta que se enfoque en “devolverle la confianza a la gente”."
6691953,"Tribunal Constitucional: vacancia, ascensos, Fujimori y Zevallos, entre los casos por resolver-En los últimos meses, el Tribunal Constitucional (TC) ha sido el escenario de la resolución de diversos conflictos legales entre instituciones y poderes del Estado. Desde la excarcelación de la lideresa de Fuerza Popular (FP), Keiko Fujimori, la disolución del Congreso de la República, la inconstitucionalidad de la suspensión del cobro de peajes, hasta la ratificación constitucional para que la Superintendencia Nacional de Aduanas y de Administración Tributaria-Sunat pueda continuar con el cobro de deudas a grandes empresas."
1229286,"Martín Vizcarra pide que Majes Siguas II sea transferido al Ministerio de Agricultura-El presidente de la República señaló que se reunió con el gobernador de Arequipa, Elmer Cáceres Llica, y, a pesar de ello, el proyecto no avanzó."
9899195,"Ministra Neyra: “El Ejecutivo no favorecerá a ningún partido o candidato en las elecciones 2021”-La titular de Justicia se pronunció luego de que el JNE publicó el cronograma para los próximos comicios del 11 de abril."
